ID,Tipo,SKU,Nome,Publicado,"Em destaque?","Visibilidade no catálogo","Descrição curta",Descrição,"Data de preço promocional começa em","Data de preço promocional termina em","Status do imposto","Classe de imposto","Em estoque?",Estoque,"Quantidade baixa de estoque","São permitidas encomendas?","Vendido individualmente?","Peso (kg)","Comprimento (cm)","Largura (cm)","Altura (cm)","Permitir avaliações de clientes?","Nota da compra","Preço promocional",Preço,Categorias,Tags,"Classe de entrega",Imagens,"Limite de downloads","Dias para expirar o download",Ascendente,"Grupo de produtos",Upsells,"Venda cruzada","URL externa","Texto do botão",Posição
445,simple,,"Pizza de Calabresa",1,0,visible,"Molho de tomate, mussarela, calabresa fatiada, rodelas de cebola, orégano e azeitonas.","Molho de tomate, mussarela, calabresa fatiada, rodelas de cebola, orégano e azeitonas.",,,taxable,,1,,,0,0,,,,,1,,45.90,55.90,Salgadas,,,https://8080-tccdoscria-tccdosmonstr-iv7oq24ittj.ws-us104.gitpod.io/wp-content/uploads/2023/08/CALABRESA.jpg,,,,,,,,,0
446,simple,,"Pizza 4 Queijos",1,0,visible,"Mussarela, Provolone, Catupiry, Cheddar, Molho de Tomate, Orégano e Azeitonas.","Mussarela, Provolone, Catupiry, Cheddar, Molho de Tomate, Orégano e Azeitonas.",,,taxable,,1,,,0,0,,,,,1,,,67.90,Salgadas,,,https://8080-tccdoscria-tccdosmonstr-iv7oq24ittj.ws-us104.gitpod.io/wp-content/uploads/2023/08/4QUEIJO.jpg,,,,,,,,,0
447,simple,,"Pizza Brócolis Especial",1,0,visible,"Molho de Tomate, Mussarela,Brócolis, Bacon, Catupiry, Palmito, Azeitona, Orégano, Tomate.","Molho de Tomate, Mussarela,Brócolis, Bacon, Catupiry, Palmito, Azeitona, Orégano, Tomate.",,,taxable,,1,,,0,0,,,,,1,,73.90,83.90,Salgadas,,,https://8080-tccdoscria-tccdosmonstr-iv7oq24ittj.ws-us104.gitpod.io/wp-content/uploads/2023/08/BROCOLIS.jpg,,,,,,,,,0
448,simple,,"Pizza Frango com Catupiry",1,0,visible,"Molho de Tomate, Mussarela, Frango desfiado, Catupiry, Azeitona, Orégano, Tomate","Molho de Tomate, Mussarela, Frango desfiado, Catupiry, Azeitona, Orégano, Tomate",,,taxable,,1,,,0,0,,,,,1,,,62.50,Salgadas,,,https://8080-tccdoscria-tccdosmonstr-iv7oq24ittj.ws-us104.gitpod.io/wp-content/uploads/2023/08/FRANCATU.jpg,,,,,,,,,0
449,simple,,"Pizza BigTurma",1,0,visible,"Molho de Tomate, Mussarela, Filé Mignon, Queijo Prato, Bacon, Molho Especial Turma do Rango, Alface e Tomate.","Molho de Tomate, Mussarela, Filé Mignon, Queijo Prato, Bacon, Molho Especial Casarão, Alface e Tomate.",,,taxable,,1,,,0,0,,,,,1,,,81.00,Salgadas,,,https://8080-tccdoscria-tccdosmonstr-iv7oq24ittj.ws-us104.gitpod.io/wp-content/uploads/2023/08/BIGTURMA.jpg,,,,,,,,,0
450,simple,,"Pizza Mussarela",1,0,visible,"Molho de tomate, mussarela, queijo parmesão ralado, tomate, orégano e azeitonas.","Molho de tomate, mussarela, queijo parmesão ralado, tomate, orégano e azeitonas.",,,taxable,,1,,,0,0,,,,,1,,40.00,47.50,Salgadas,,,https://8080-tccdoscria-tccdosmonstr-iv7oq24ittj.ws-us104.gitpod.io/wp-content/uploads/2023/08/MUSSA.jpg,,,,,,,,,0
458,simple,,"Pizza Sensação",1,0,visible,"<span class=""ui-provider en ayk bbm bmh bmi bmj bmk bml bmm bmn bmo bmp bmq bmr bms bmt bmu bmv bmw bmx bmy bmz bna bnb bnc bnd bne bnf bng bnh bni bnj bnk bnl bnm"" dir=""ltr"">Creme de Avelã e Creme de Morango.</span>","<span class=""ui-provider en ayk bbm bmh bmi bmj bmk bml bmm bmn bmo bmp bmq bmr bms bmt bmu bmv bmw bmx bmy bmz bna bnb bnc bnd bne bnf bng bnh bni bnj bnk bnl bnm"" dir=""ltr"">Creme de Avelã e Creme de Morango.</span>",,,taxable,,1,,,0,0,,,,,1,,,55.00,Doce,,,https://8080-tccdoscria-tccdosmonstr-iv7oq24ittj.ws-us104.gitpod.io/wp-content/uploads/2023/09/sensacao.png,,,,,,,,,0
459,simple,,"Pizza Brigadeiro",1,0,visible,"Chocolate Nestlé ao leite, granulado e morango.","Chocolate Nestlé ao leite, granulado e morango.",,,taxable,,1,,,0,0,,,,,1,,,50.00,Doce,,,https://8080-tccdoscria-tccdosmonstr-iv7oq24ittj.ws-us104.gitpod.io/wp-content/uploads/2023/09/MicrosoftTeams-image-3.png,,,,,,,,,0
